{
  "schema_version": "graph-view/v1",
  "snapshot_id": "p7-heat-v1",
  "view_kind": "hotspot_heat",
  "nodes": [
    {
      "id": "hot1",
      "label": "busy.py",
      "kind": "Hotspot",
      "tier": "T1",
      "confidence": "heuristic",
      "lod_rank": 0,
      "citation": { "node_ids": ["hot1"], "file_path": "busy.py" },
      "x": 100.0,
      "y": 100.0,
      "heat": 9.0
    },
    {
      "id": "hot2",
      "label": "quiet.py",
      "kind": "Hotspot",
      "tier": "T1",
      "confidence": "heuristic",
      "lod_rank": 1,
      "citation": { "node_ids": ["hot2"], "file_path": "quiet.py" },
      "x": 220.0,
      "y": 100.0,
      "heat": 2.0
    }
  ],
  "edges": [],
  "budget": { "max_nodes": 80, "max_edges": 160, "nodes_used": 2, "edges_used": 0 },
  "layout": { "algorithm": "radial", "seed": "p7hotseed000001" }
}
